{
  "$schema": "https://opencode.ai/config.json",
  "shell": "pwsh",
  "model": "opencode/deepseek-v4-flash-free",

  "instructions": [
    "You are running in a native Windows environment. Linux Bash is NOT available.",
    "Always use PowerShell (pwsh) syntax for any shell operations (e.g., Get-ChildItem, Select-String, Test-Path).",
    "Never use Unix/Bash-specific commands (like ls, grep, rm -rf, export, cat) or bash control structures.",
    "Use Windows path formats with backslashes (\\) or escaping where appropriate."
  ],

  "lsp": {
    "python": {
      "command": ["pyright-langserver", "--stdio"],
      "extensions": [".py", ".pyi"],
      "env": {
        "PATH": "{{env.PATH}};{{env.USERPROFILE}}\\AppData\\Local\\Programs\\Python\\Python311\\Scripts;C:\\Users\\{{env.USERNAME}}\\AppData\\Roaming\\npm"
      }
    }
  },

  "agent": {
    "code-reviewer": {
      "description": "审查代码质量、潜在 bug 与边界情况，只读不改",
      "mode": "subagent",
      "model": "opencode/big-pickle",
      "temperature": 0.1,
      "prompt": "你是资深代码审查员，重点关注：安全性、性能、可维护性、边界情况。只给建设性反馈，不直接改代码。",
      "permission": {
        "edit": "deny",
        "write": "deny",
        "bash": "deny",
        "task": "deny"
      }
    },

    "algo-thinker": {
      "description": "纯算法与逻辑推理，不碰文件",
      "mode": "subagent",
      "model": "opencode/nemotron-3-ultra-free",
      "permission": {
        "edit": "deny",
        "write": "deny",
        "bash": "deny",
        "task": "deny"
      }
    }
  }
}